[
  {
    "abstraction": 0.98,
    "business_relevance": 0.88,
    "compiler_centrality": 0.98,
    "debugging": 0.86,
    "documentation": 0.9,
    "governance_caution": 0.9,
    "human_readability": 0.96,
    "humanization_score": 0.918,
    "institutional_scale": 0.92,
    "interpretive_status": "core_hopper_compiler_humanization_thread",
    "portability": 0.92,
    "standards": 0.88,
    "theme_id": "compiler_as_bridge"
  },
  {
    "abstraction": 0.96,
    "business_relevance": 0.84,
    "compiler_centrality": 0.96,
    "debugging": 0.82,
    "documentation": 0.84,
    "governance_caution": 0.86,
    "human_readability": 0.9,
    "humanization_score": 0.878,
    "institutional_scale": 0.88,
    "interpretive_status": "core_hopper_compiler_humanization_thread",
    "portability": 0.9,
    "standards": 0.82,
    "theme_id": "automatic_programming"
  },
  {
    "abstraction": 0.92,
    "business_relevance": 0.82,
    "compiler_centrality": 0.94,
    "debugging": 0.8,
    "documentation": 0.84,
    "governance_caution": 0.84,
    "human_readability": 0.84,
    "humanization_score": 0.85,
    "institutional_scale": 0.86,
    "interpretive_status": "core_hopper_compiler_humanization_thread",
    "portability": 0.86,
    "standards": 0.78,
    "theme_id": "a0_a2_subroutine_translation"
  },
  {
    "abstraction": 0.94,
    "business_relevance": 0.98,
    "compiler_centrality": 0.94,
    "debugging": 0.84,
    "documentation": 0.88,
    "governance_caution": 0.88,
    "human_readability": 0.98,
    "humanization_score": 0.912,
    "institutional_scale": 0.94,
    "interpretive_status": "core_hopper_compiler_humanization_thread",
    "portability": 0.88,
    "standards": 0.86,
    "theme_id": "flow_matic_english_like_programming"
  },
  {
    "abstraction": 0.92,
    "business_relevance": 0.98,
    "compiler_centrality": 0.9,
    "debugging": 0.88,
    "documentation": 0.92,
    "governance_caution": 0.92,
    "human_readability": 0.98,
    "humanization_score": 0.94,
    "institutional_scale": 0.98,
    "interpretive_status": "core_hopper_compiler_humanization_thread",
    "portability": 0.94,
    "standards": 0.98,
    "theme_id": "cobol_business_computation"
  },
  {
    "abstraction": 0.86,
    "business_relevance": 0.86,
    "compiler_centrality": 0.82,
    "debugging": 0.98,
    "documentation": 0.98,
    "governance_caution": 0.92,
    "human_readability": 0.92,
    "humanization_score": 0.898,
    "institutional_scale": 0.92,
    "interpretive_status": "major_hopper_compiler_humanization_thread",
    "portability": 0.82,
    "standards": 0.9,
    "theme_id": "documentation_debugging_culture"
  },
  {
    "abstraction": 0.9,
    "business_relevance": 0.94,
    "compiler_centrality": 0.88,
    "debugging": 0.9,
    "documentation": 0.94,
    "governance_caution": 0.98,
    "human_readability": 0.88,
    "humanization_score": 0.936,
    "institutional_scale": 0.98,
    "interpretive_status": "core_hopper_compiler_humanization_thread",
    "portability": 0.98,
    "standards": 0.98,
    "theme_id": "standards_validation_institutional_computing"
  },
  {
    "abstraction": 0.96,
    "business_relevance": 0.88,
    "compiler_centrality": 0.82,
    "debugging": 0.94,
    "documentation": 0.92,
    "governance_caution": 0.98,
    "human_readability": 0.94,
    "humanization_score": 0.912,
    "institutional_scale": 0.94,
    "interpretive_status": "major_hopper_compiler_humanization_thread",
    "portability": 0.86,
    "standards": 0.88,
    "theme_id": "ai_code_generation_caution"
  }
]